{
  "schemaVersion": 1,
  "packageId": "easyhci",
  "catalogId": "easyhci",
  "displayName": "EasyHCI",
  "version": "1.3.0",
  "package": {
    "kind": "zip",
    "fileName": "EasyHCI.zip"
  },
  "source": {
    "url": "https://github.com/JunesuChoi/EasyHCI/releases/download/v1.3.0/EasyHCI.zip",
    "trust": "official-github-release",
    "sha256": "4B570CB41B87484CBE1C000B3EB2EDD93BBC5BA69A4955B575FD592D70D2FC61"
  },
  "risk": {
    "highLoad": true,
    "writesData": false,
    "requiresAdmin": true,
    "requiresReboot": false
  },
  "redistribution": {
    "allowed": true,
    "note": "MIT licensed fork of Manbocoon/EasyHCI, notice retained. The archive carries no HCI MemTest binary: memtest.exe stays a separate download from HCI Design because it is proprietary freeware and may not be embedded or redistributed."
  },
  "update": {
    "strategy": "github-release"
  }
}
